{
  "$schema": "http://json-schema.org/draft-07/schema#",
  "type": "object",
  "required": ["date", "slug", "summary", "impact", "fix", "lessons"],
  "properties": {
    "date": {"type": "string", "format": "date"},
    "slug": {"type": "string"},
    "summary": {"type": "string"},
    "impact": {"type": "string"},
    "fix": {"type": "string"},
    "lessons": {"type": "string"}
  }
}
