{
  "date": "2026-04-20",
  "slug": "relay-landing-chat-api-v1-key-format-regression",
  "summary": "Relay landing-page chat at / regressed after API v1 key-format migration because static/chat.js consumed public_key as direct PEM while the API returned Base64-encoded PEM bytes; a first patch normalized keys but incorrectly kept relay-path /api/v2 streaming-first behavior before /api/v1.",
  "impact": "Users running local relay mode could not complete end-to-end landing-page chat conversations, blocking validation of the primary browser chat journey.",
  "fix": "Normalized API public keys in static/chat.js, removed relay-path /api/v2 streaming attempts from landing chat send flow, and enforced API v1-only non-streaming relay chat coverage in e2e/unit tests.",
  "lessons": "Browser crypto bootstrapping must enforce explicit key-format normalization, and relay-path chat tests/docs must lock in API v1-only non-streaming behavior until API v1 launch on sugarkube is complete."
}
