{
  "date": "2026-06-04",
  "slug": "packaged-desktop-llama-cpp-import-timeout",
  "summary": "Packaged desktop compute-node startup timed out in a child llama_cpp import watchdog after runtime setup had already found a supported CUDA runtime, preventing Registered: yes.",
  "impact": "Windows packaged operators could fail/stopped before relay registration, and the shared packaged import seam also risked macOS Metal parity.",
  "fix": "Kept the startup-critical child import watchdog removed, made the retained subprocess runtime facade replay the desktop bootstrap/path contract, normalized packaged Windows paths, surfaced child exit stdout/stderr/exit-code diagnostics, and skipped unregister before successful registration.",
  "lessons": "Packaged e2e must prove registered=true for the full desktop + relay lifecycle and must exercise shared runtime/bootstrap code instead of only inspect or mock paths. Native-extension subprocesses must either be environment-equivalent to the successful desktop probe or fail with actionable stderr/stdout/exit-code diagnostics."
}
